name_author,date_publication,text_comment,answer_to,name_article
Роза,2020-07-29 22:46:26,в Нур-Султане когда-нибудь с клопами разберутся? или это кому-то выгодно?,,Жители Усть-Каменогорска жалуются на нашествие крыс
Виктор Белый,2020-07-29 23:06:13,"Пока акима не укусит, толку не будет))) а как красиво заливает работник кск))) прям умора. На ходу сочинила!!!))))",,Жители Усть-Каменогорска жалуются на нашествие крыс
Марина Лигай,2020-07-29 22:05:10,"Вы вроде и ничего не делать не можете, и делаете а толку в целом нет",,МВК рассмотрела поручение Президента по продлению карантина
Владимир,2020-07-29 22:38:52,Прям в точку сказали !!!,Марина Лигай,МВК рассмотрела поручение Президента по продлению карантина
Хозяин умпалумп,2020-07-29 20:59:21,"ну правильно, они нужнее в самих США, что бы охранять бункер Трампа, там сейчас гражданская война в разгаре. Амриканские копы на коленях перед неграми, а ведь еще возвращать земли Мексике - это Штат Техас и американским индейцам, это всё США",,"США выводят из Германии 11, 9 тысяч военнослужащих"
Хозяин умпалумп,2020-07-29 21:02:45,"США откровенно разваливаются. Армия на улицах. Это война. И единственное что сейчас еще контролирует Трамп, это лужайку перед Белым Домом и мочеиспускание, хотя думаю Трамп  сидя в бункере с мокрыми штанами....это уже под вопросом короче))",,"США выводят из Германии 11, 9 тысяч военнослужащих"
Вот оно чо Михалыч,2020-07-29 23:03:58,"США откровенно разваливаются======Мировая новость.Вот тока весь мир об этом не слышал....Как весь мир не слышал ? Эту ж новость всему миру обьявил ХУ...Не слышали о ХУ ? Как так, ведь это ж всемирный прорицатель.",Хозяин умпалумп,"США выводят из Германии 11, 9 тысяч военнослужащих"
ХерЛиОн,2020-07-29 21:51:21,"Устали ждать, когда же русские придут ",,"США выводят из Германии 11, 9 тысяч военнослужащих"
"""Велико""Toibastarec",2020-07-29 21:55:09,Немцы слушают Scorpions - Wind of Changes,,"США выводят из Германии 11, 9 тысяч военнослужащих"
Плеканец Плеканец,2020-07-29 22:22:26,Начало конца оккупации,,"США выводят из Германии 11, 9 тысяч военнослужащих"
сланцевый майданщик,2020-07-29 22:25:22,"индейцы насторожились...сперва немцы - а, потом навахо?",,"США выводят из Германии 11, 9 тысяч военнослужащих"
Spears,2020-07-29 22:38:11,"Капец тут Кремлеботов развелось, одни правокаторы сидят, даже страшно становится (((",,"США выводят из Германии 11, 9 тысяч военнослужащих"
Плеканец Плеканец,2020-07-29 22:40:18,"За гранты, которые тоже могут урезать, по аналогии с американскими солдатами в Европе?",Spears,"США выводят из Германии 11, 9 тысяч военнослужащих"
Ахмад-Шах Массуд,2020-07-29 21:56:20,"Классный трендовый костюм, стильный галстук, респектабельный вид..... Помню по г.Уральску - три сотки по которым не дозвонится.....",,Назначен первый заместитель акима Шымкента
USSR,2020-07-29 22:27:30,"В Шымкенте жарковато будет ему, костюмчик там помнётся немного))))",,Назначен первый заместитель акима Шымкента
Otto,2020-07-29 20:02:43,"такая милая девушка, как жаль, если это он, до надеюсь понесет заслуженное наказание",,Мама Томирис Байсафы поблагодарила Токаева за помощь
Вот оно чо Михалыч,2020-07-29 23:16:34,"Ахренеть...Понадобилось вмешательстельство кого там, чтобы там по закону решали.",Otto,Мама Томирис Байсафы поблагодарила Токаева за помощь
arqa,2020-07-29 20:13:18,опасное место эта Москва для наших ...,,Мама Томирис Байсафы поблагодарила Токаева за помощь
Late05,2020-07-29 20:15:31,Оно для всех опасное...,arqa,Мама Томирис Байсафы поблагодарила Токаева за помощь
Лиза Куанова,2020-07-29 21:46:34,"Да с Вами согласна но балдарымыздың саңалары жоғар болғай ,бүл өмір ғой қүыршақ болмау керек ешкемнің қолыңда сыңдырып тастайды !",arqa,Мама Томирис Байсафы поблагодарила Токаева за помощь
Бахыт Талысбаева,2020-07-29 21:57:25,Сіз не деп тұрсыз???? Бұл не сандырағвңыз??? Қайдағы құыршақ???,Лиза Куанова,Мама Томирис Байсафы поблагодарила Токаева за помощь
Dimash,2020-07-29 20:15:33,,,Мама Томирис Байсафы поблагодарила Токаева за помощь
alenkaB,2020-07-29 20:27:02,Наконец-то сдвинулось следствие с мертвой точки!!! Жанна надеюсь  клеймо самоубийцы снимут с Томпи.,,Мама Томирис Байсафы поблагодарила Токаева за помощь
Тимур Нигмадилов,2020-07-29 20:28:29,"Для того чтобы свершилось правосудие, надо обращаться к президенту. Царь хороший - бояре плохие )?",,Мама Томирис Байсафы поблагодарила Токаева за помощь
Бахыт Талысбаева,2020-07-29 21:05:33,"Если вы заметили, то дело было заведено в Москве и его заволокитили, все время менялись следователи. Если бы не Тас (экс-посол) и прием у КЖТ, вряд ли бы дело сдвинулось с мертвой точки, т.к. подозреваемое лицо сын высокопост чиновника (в деле указывался как свидетель)",Тимур Нигмадилов,Мама Томирис Байсафы поблагодарила Токаева за помощь
Gassyrbek Ayapov,2020-07-29 20:52:13,"Я очень рад за вас Жанна! К сожалению это не вернёт вам вашу дочурку, но справедливость должна восторжествовать! Қарынжасымыздың жаны жәннәтта болсын!",,Мама Томирис Байсафы поблагодарила Токаева за помощь
Лиза Куанова,2020-07-29 21:33:04,"Молодец я аплодирую всем кто принял участие в деле этой девушки!Я когда то писала матери Томпи ""не сдавайся ты мать это твой ребëнок вставай иди вперëд!"" Если уважаешь свою мать и хочешь жениться на женщине своей нации, не надо глумиться над чужими !Эта нация одна из верущих Аллаху, но почему они идут на убииство ?",,Мама Томирис Байсафы поблагодарила Токаева за помощь
Данияр Саматбек,2020-07-29 21:44:22,"Её отправили туда у читься, а она ходила с кавказцем, куда смотрели её родители?!!!!",,Мама Томирис Байсафы поблагодарила Токаева за помощь
Бахыт Талысбаева,2020-07-29 21:59:33,"Ауызыңа келгенді оттама, ауызыңды бағып сөйле, оңбаған",Данияр Саматбек,Мама Томирис Байсафы поблагодарила Токаева за помощь
Dastan Esenbekov,2020-07-29 22:46:37,Аузынды озын багып сойле манка,Бахыт Талысбаева,Мама Томирис Байсафы поблагодарила Токаева за помощь
Данияр Саматбек,2020-07-29 21:48:06,"Сама виновата, нечего было ходить с кавказцем.",,Мама Томирис Байсафы поблагодарила Токаева за помощь
Advokat,2020-07-29 22:36:11,"""Уважаемый"", нехорошо так говорить об умершей девушке, не красит такое. Адал казак жигит олай айтпайды.",Данияр Саматбек,Мама Томирис Байсафы поблагодарила Токаева за помощь
Dastan Esenbekov,2020-07-29 22:39:00,Жогалш,Advokat,Мама Томирис Байсафы поблагодарила Токаева за помощь
Fack,2020-07-29 19:57:07,"Сволочь, на тротуаре сбил бедного пешехода, даже не на дороге, а НА ТРОТУАРЕ!",,Пешехода сбили насмерть в Алматы
Посетитель,2020-07-29 19:59:14,"Читай внимательней: ""По словам пассажира Mazda, на бордюре у тротуара сидел мужчина. По всей видимости, он хотел привстать. Но после неудачной попытки его ""повело"" прямо под колеса автомобиля.

Водитель попытался избежать столкновения, резко вырулил в сторону, наехал на бордюр и сбил пешехода.""",Fack,Пешехода сбили насмерть в Алматы
User,2020-07-29 20:12:39,"Поэтому дцмаю нужно ездить с видео-регистраторами, чтобы было хоть какое-то доказательство",,Пешехода сбили насмерть в Алматы
A B,2020-07-29 20:24:48,"Что не день, то жертва",,Пешехода сбили насмерть в Алматы
Александр Плотников,2020-07-29 21:29:34,Похоже на то что 2 мазды решили пободаться чиркнулись и 1 вылетел на пешехода,,Пешехода сбили насмерть в Алматы
"""Велико""Toibastarec",2020-07-29 19:29:48," Нет слов, одни эмоции.",,"В Беларуси заявили о задержании боевиков ЧВК ""Вагнер"""
"""Велико""Toibastarec",2020-07-29 19:49:58,Гениально!,"""Велико""Toibastarec","В Беларуси заявили о задержании боевиков ЧВК ""Вагнер"""
Бари,2020-07-29 21:02:18,"Только несведующему не понятно, что это хорошо спланированная провокация. Теперь нужно просто понять, кому это выгодно? Кому из белорусских политиков было выгодно ""пригласить"" бойцов ЧВК под любым предлогом, а затем с шумихой их арестовать?","""Велико""Toibastarec","В Беларуси заявили о задержании боевиков ЧВК ""Вагнер"""
Бари,2020-07-29 21:02:47,"Еще неделю назад один из «кандидатов в президенты Белоруссии», во время встречи с военными, говорил, что возможно скоро в Беларусь из другой страны приедут бывшие военные, чтоб дестабилизировать обстановку и создать второй Майдан. И тут же такой фокус!!! По мне, так это всего лишь лишь пиар компания одного из кандидатов в президенты, которая дает право в случае чего, сразу после выборов объявить ЧС и вывести войска на улицу, чтоб утихомирить несогласных с итогами выборов","""Велико""Toibastarec","В Беларуси заявили о задержании боевиков ЧВК ""Вагнер"""
Будущее,2020-07-29 21:58:48,Псы войны позорные !Еще и лейбл носят Смерть это бизнес.С такими мозгами и моралью конечно.,"""Велико""Toibastarec","В Беларуси заявили о задержании боевиков ЧВК ""Вагнер"""
"""Велико""Toibastarec",2020-07-29 22:08:45,"Аналоги Вагнеровцев есть в каждой современной армии мира. Россия в этом плане слишком поздно создала ЧВК. США, Британия, Франция со своими прокси силами в Афганистане со времен СССР в свое время многим пакистанцам и афганцам дали в руки оружие. Даже Турция и Украина создали свои наборы прокси отрядов. Такова реалия, что без ЧВК ни одна страна сегодня не обходится.",Будущее,"В Беларуси заявили о задержании боевиков ЧВК ""Вагнер"""
Исмаил Самуилович Шариков,2020-07-29 22:44:28,"Вас не смущает тот факт, что согласно законодательству РФ такого рода частные военные формирования запрещены?","""Велико""Toibastarec","В Беларуси заявили о задержании боевиков ЧВК ""Вагнер"""
Хозяин умпалумп,2020-07-29 22:46:00,А тебя не смущает тот факт что они в США давно легализованы и почему то участвовали в Ираке в похищениях и пытках? А так же тот факт что армии Укроены есть иностранные наемники,Исмаил Самуилович Шариков,"В Беларуси заявили о задержании боевиков ЧВК ""Вагнер"""
Исмаил Самуилович Шариков,2020-07-29 22:51:07,"Вот именно: они хотя бы не собственные законы не нарушают. А так снова по факту получается, что высокодуховные ничуть не лучше бездуховных с ""загнивающего Запада"" и пользуются их же методами. Хоть бы что-то оригинальное придумали, ведь они якобы самые умные, не то что ""тупыыые американцы"".",Хозяин умпалумп,"В Беларуси заявили о задержании боевиков ЧВК ""Вагнер"""
"""Велико""Toibastarec",2020-07-29 22:54:13,Наверняка внесут поправки законодательство скоро. Мы же не знаем весь список законодательных актов Гос.думы РФ который стоит на повестке дня.,Исмаил Самуилович Шариков,"В Беларуси заявили о задержании боевиков ЧВК ""Вагнер"""
"""Велико""Toibastarec",2020-07-29 22:57:45,Она учла эту семейную беду и решила бороться с ней на законодательном уровне,Исмаил Самуилович Шариков,"В Беларуси заявили о задержании боевиков ЧВК ""Вагнер"""
Исмаил Самуилович Шариков,2020-07-29 22:59:01,"Ну да, это характерно для РФ: сначала начудить, а потом законодательство под это дело подгонять. Влияние Золотой Орды до сих пор сказывается.","""Велико""Toibastarec","В Беларуси заявили о задержании боевиков ЧВК ""Вагнер"""
"""Велико""Toibastarec",2020-07-29 23:03:42,Преемница современной золотой орды Москва поэтому от части влияние передалось.,Исмаил Самуилович Шариков,"В Беларуси заявили о задержании боевиков ЧВК ""Вагнер"""
Казах-PRO .,2020-07-29 23:09:44,"Давай тебе задам дешёвый вопрос от вашего ""хозяина перхоти 3D-луп"":""Они тебе сами признались !? ""","""Велико""Toibastarec","В Беларуси заявили о задержании боевиков ЧВК ""Вагнер"""
Исмаил Самуилович Шариков,2020-07-29 19:43:41,Ихтамнет!,,"В Беларуси заявили о задержании боевиков ЧВК ""Вагнер"""
Исмаил Самуилович Шариков,2020-07-29 19:44:05,Они просто хотели шпиль посмотреть.,,"В Беларуси заявили о задержании боевиков ЧВК ""Вагнер"""
Валерий В,2020-07-29 19:50:53,"И у всех на правом запястье была наколка ""KGB"" ",,"В Беларуси заявили о задержании боевиков ЧВК ""Вагнер"""
Бари,2020-07-29 20:00:59,А в карманах расписханы пробирки с «Новичком»...,Валерий В,"В Беларуси заявили о задержании боевиков ЧВК ""Вагнер"""
Будущее,2020-07-29 21:59:55,"Наколка ""Вова Бог !""Каждому тупому прыщу своего ""бога""",Валерий В,"В Беларуси заявили о задержании боевиков ЧВК ""Вагнер"""
сланцевый майданщик,2020-07-29 22:28:55,"если хотели организовать майдан, надо было искать тату ""майдан - это демократия; демократия - это майдан""...или ""мы нирабы - нирабы мы""",Будущее,"В Беларуси заявили о задержании боевиков ЧВК ""Вагнер"""
Куерти Клавиатуров,2020-07-29 19:51:22,ЧВК- это чуваки?,,"В Беларуси заявили о задержании боевиков ЧВК ""Вагнер"""
Будущее,2020-07-29 22:00:22,Это продажные шныри,Куерти Клавиатуров,"В Беларуси заявили о задержании боевиков ЧВК ""Вагнер"""
Хозяин умпалумп,2020-07-29 22:46:38,Такие же продажные шныри как американская Блэк Вотер убивавшая иракцев и похищающая людей по всему миру?,Будущее,"В Беларуси заявили о задержании боевиков ЧВК ""Вагнер"""
сланцевый майданщик,2020-07-29 22:29:41,я бы даже сказал - шар-ла-та-ны,Куерти Клавиатуров,"В Беларуси заявили о задержании боевиков ЧВК ""Вагнер"""
Куерти Клавиатуров,2020-07-29 19:54:37,"Не уж то наследники советской развед школы могли направить туда толпу военных, чо то не вериться!",,"В Беларуси заявили о задержании боевиков ЧВК ""Вагнер"""
Max Sheriff,2020-07-29 19:54:42,"Россия- коварная,  подлая,  лживая страна абсолютных мерзавцев!",,"В Беларуси заявили о задержании боевиков ЧВК ""Вагнер"""
Хозяин умпалумп,2020-07-29 20:03:50,Которая посылает врачей на помощь в Казахстан и в которую твои земляки едут на заработки. Ох уж подлая Россия,Max Sheriff,"В Беларуси заявили о задержании боевиков ЧВК ""Вагнер"""
Tajimon,2020-07-29 20:59:02,"Помощь оказывает и Китай и арабы, а вот гастарбайтеров казахов  ты не найдёшь в своей Рашке ...",Хозяин умпалумп,"В Беларуси заявили о задержании боевиков ЧВК ""Вагнер"""
Бари,2020-07-29 21:09:04,"Гастрабайтеров казахов в России, тяжело было найти в 90-х годах. А сейчас и в Москве, и в Петербурге, даже в Волгограде полно. В Москве, в Железнодорожном, два казаха выполняют черную работу в магазине у хозяина азербайджанца",Tajimon,"В Беларуси заявили о задержании боевиков ЧВК ""Вагнер"""
Хозяин умпалумп,2020-07-29 21:11:35,ты Новосибирске был хоть раз?,Tajimon,"В Беларуси заявили о задержании боевиков ЧВК ""Вагнер"""
arqa,2020-07-29 21:46:10,"Я двух москичей в юко видал, хлопок голыми руками собирал.... это тебе равнозначный ответ))))",Бари,"В Беларуси заявили о задержании боевиков ЧВК ""Вагнер"""
Исаак ,2020-07-29 21:50:29,"Каждая третья кассирша в РФ,  в супермаркетах и в магазинах у дома - родом из Казахстана ( Талды Курган, Тараз, Шымкент, Шу, и т.д.)",Tajimon,"В Беларуси заявили о задержании боевиков ЧВК ""Вагнер"""
Alex,2020-07-29 22:05:43,Только падонки так отвечают на помощь,Tajimon,"В Беларуси заявили о задержании боевиков ЧВК ""Вагнер"""
сланцевый майданщик,2020-07-29 22:31:48,"я видел Тадж-Махал в Индии...и вы, даже, рассказывали мне, кто его построил...хотите поменять свои показания?",Tajimon,"В Беларуси заявили о задержании боевиков ЧВК ""Вагнер"""
Бахыт Талысбаева,2020-07-29 22:33:52,"Ога, ога, ты у них паспорта проверял? )))Ты кыргызку отличишь от казашки???Это ПРОСТО для вас, шовиков, ЕщЕ одна возможность доставить себе кайф называть нас, казахов, гастерами, исказить наши ФИО.Эти прилагательные заговариваются, но потом вспоминают про свою валову-шевцову и включают заднюю.",Исаак ,"В Беларуси заявили о задержании боевиков ЧВК ""Вагнер"""
