name_author,date_publication,text_comment,answer_to,name_articleСағыныш Жумагельдина,2020-07-29 20:30:29,"Бостан-босқа шулай бергенше, сабырлық танытайық",Динара Каржаева,Почти 2 миллиона казахстанцев получили выплату в 42 500 тенге
Динара Каржаева,2020-07-29 15:43:48,"Мына вирустанда құтылып, барлық жұмыс орындары іске қосылып, өз орындарына келер күнде алыс емес",,Почти 2 миллиона казахстанцев получили выплату в 42 500 тенге
Айсана,2020-07-29 17:31:33,кудай каласа солай болсын! Ешким ауырмасын!,Динара Каржаева,Почти 2 миллиона казахстанцев получили выплату в 42 500 тенге
Сағыныш Жумагельдина,2020-07-29 20:27:38,Барлық аурып жатқан науқастар жазылып кетсін,Айсана,Почти 2 миллиона казахстанцев получили выплату в 42 500 тенге
Сағыныш Жумагельдина,2020-07-29 20:26:53,Сол күнді асыға күтудемін,Динара Каржаева,Почти 2 миллиона казахстанцев получили выплату в 42 500 тенге
Максат Сериков,2020-07-29 15:56:22,"Қүантатын жағдай, халықтың қаншамасы риза болып қалдығой",,Почти 2 миллиона казахстанцев получили выплату в 42 500 тенге
Асыл Куанбековна,2020-07-29 16:44:32,Иә қуанышымызға орай солай,Максат Сериков,Почти 2 миллиона казахстанцев получили выплату в 42 500 тенге
Гулимай Адилбек,2020-07-29 18:47:37,дұрыс айтасыз,Асыл Куанбековна,Почти 2 миллиона казахстанцев получили выплату в 42 500 тенге
Айсана,2020-07-29 17:29:42,"дурыс айтасыз,казир жагдай арине онай деп айта алмайсын",Максат Сериков,Почти 2 миллиона казахстанцев получили выплату в 42 500 тенге
Айсана,2020-07-29 17:30:03,дегенмен укимет те халыкты жалгыз тастап откан жок кой,Айсана,Почти 2 миллиона казахстанцев получили выплату в 42 500 тенге
Айсана,2020-07-29 17:30:28,"не болса да барынша комек берип, акша болип жатыр",Айсана,Почти 2 миллиона казахстанцев получили выплату в 42 500 тенге
Гулимай Адилбек,2020-07-29 18:48:19,бұл қиындықтыда бірлігіміздің арқасында жеңіп шығармыз,Айсана,Почти 2 миллиона казахстанцев получили выплату в 42 500 тенге
Гулимай Адилбек,2020-07-29 18:48:59,халықты қолдау мақсатында талай бағдарламалар жасалып жатыр,Айсана,Почти 2 миллиона казахстанцев получили выплату в 42 500 тенге
Гулимай Адилбек,2020-07-29 18:49:16,иә расыменде,Айсана,Почти 2 миллиона казахстанцев получили выплату в 42 500 тенге
Айсана,2020-07-29 17:30:53,одан болек волонтерлардын да тарапынан улкен комек тиып жатыр,Максат Сериков,Почти 2 миллиона казахстанцев получили выплату в 42 500 тенге
Гулимай Адилбек,2020-07-29 18:49:46,иә солай волонтерлар нағыз ерлік танытып жүр,Айсана,Почти 2 миллиона казахстанцев получили выплату в 42 500 тенге
Гулимай Адилбек,2020-07-29 18:47:18,қазіргі кезеде әрбір көмек ауадай қажет,Максат Сериков,Почти 2 миллиона казахстанцев получили выплату в 42 500 тенге
Максат Сериков,2020-07-29 16:01:17,Егер жағдайларыңыз жетіп жатса жағдайы төмен отбасыларға ең болмағанда бір айлық продуктысын алып барып беріңіздер бұл да бір көмекқой,,Почти 2 миллиона казахстанцев получили выплату в 42 500 тенге
Айсана,2020-07-29 17:28:27,осындай жумысты негизи волонтерлар оте жаксы жасап жур,Максат Сериков,Почти 2 миллиона казахстанцев получили выплату в 42 500 тенге
Айсана,2020-07-29 17:28:39,солардан улги алу кажет,Айсана,Почти 2 миллиона казахстанцев получили выплату в 42 500 тенге
Гулимай Адилбек,2020-07-29 18:44:11,Еріктілердің жасап жатқан игі істерінің саны шексіз. Осы уақытқа дейін қаншама жақсылықтар жасалып келді. Халық волонтерларға өз баталарын беріп жүр,Айсана,Почти 2 миллиона казахстанцев получили выплату в 42 500 тенге
Гулимай Адилбек,2020-07-29 18:44:37,Біразымыз үлгі алар істер атқарып жүр,Айсана,Почти 2 миллиона казахстанцев получили выплату в 42 500 тенге
Гулимай Адилбек,2020-07-29 18:42:14,"міне құрбан айтта жетіп қалды, осылайда сауап жинауға болады",Максат Сериков,Почти 2 миллиона казахстанцев получили выплату в 42 500 тенге
Максат Сериков,2020-07-29 16:02:18,"Қазіргі қиын жағдайда тек мемлекеттен көмек күтпей халық болып бір бірімізгеде көмек беруіміз керек, бірігіп қана жеңеміз бұл індетті",,Почти 2 миллиона казахстанцев получили выплату в 42 500 тенге
Айсана,2020-07-29 17:27:53,"дурыс айтасыз,барлыгын тек укиметке тастай салуга болмайды гой.Озмиз де арекет етуимиз кажет",Максат Сериков,Почти 2 миллиона казахстанцев получили выплату в 42 500 тенге
Гулимай Адилбек,2020-07-29 18:40:44,Барлық жауапкершілікті мемлекеттің бойына іліп қою дұрыс емес. Мемлекетпен сіз біз десіп барлық қиындықты оңай жеңуге болады. Бірлік түбі тірлік,Айсана,Почти 2 миллиона казахстанцев получили выплату в 42 500 тенге
Гулимай Адилбек,2020-07-29 18:38:49,"Еліміздің басына күн туып жатқан уақытта. Тізе біріктіріп, бірлесетін кез келгендей. Әрдайым бір-бірлеріне қол созуға дайын болу керек. Бірігіп қана толықтай бұл вирусты жеңе аламыз",Максат Сериков,Почти 2 миллиона казахстанцев получили выплату в 42 500 тенге
Максат Сериков,2020-07-29 16:13:03,2млнөте жақсығой қаншама адам алып қүанып қалған шығар,,Почти 2 миллиона казахстанцев получили выплату в 42 500 тенге
Айсана,2020-07-29 17:27:36,"соны айтам,каншама адамдарга жаксы комек",Максат Сериков,Почти 2 миллиона казахстанцев получили выплату в 42 500 тенге
Гулимай Адилбек,2020-07-29 18:36:10,дұрыс айтасыз,Айсана,Почти 2 миллиона казахстанцев получили выплату в 42 500 тенге
Гулимай Адилбек,2020-07-29 18:35:58,дағдарыс кезінде осындай мөлшерде көмек беріліп жатқаны қуантарлық жағдай,Максат Сериков,Почти 2 миллиона казахстанцев получили выплату в 42 500 тенге
Айсана,2020-07-29 17:17:53,Хорошая новость!,,Почти 2 миллиона казахстанцев получили выплату в 42 500 тенге
Гулимай Адилбек,2020-07-29 18:34:39,Согласна,Айсана,Почти 2 миллиона казахстанцев получили выплату в 42 500 тенге
Айсана,2020-07-29 17:18:09,"Деньги выделяются поэтапно,так что всем терпения",,Почти 2 миллиона казахстанцев получили выплату в 42 500 тенге
Гулимай Адилбек,2020-07-29 18:34:07,Сәл сабырлық танытайық,Айсана,Почти 2 миллиона казахстанцев получили выплату в 42 500 тенге
Birzhan,2020-07-29 18:38:46,Дұрыс айтасыз,Гулимай Адилбек,Почти 2 миллиона казахстанцев получили выплату в 42 500 тенге
Айсана,2020-07-29 17:18:43,Все таки правильно делают что выдают первым тем кто более социально уязвим,,Почти 2 миллиона казахстанцев получили выплату в 42 500 тенге
Гулимай Адилбек,2020-07-29 18:33:30,аз қамтылған отбасылармен мұқтаж жандарға жәрдемақы беріліп жатыр,Айсана,Почти 2 миллиона казахстанцев получили выплату в 42 500 тенге
Айсана,2020-07-29 17:19:29,"Все таки правительство молодцы,что не оставляют один на один с бедой",,Почти 2 миллиона казахстанцев получили выплату в 42 500 тенге
Гулимай Адилбек,2020-07-29 18:31:04,елдә қолдау мақсатынды талай істер атқарылып жатыр,Айсана,Почти 2 миллиона казахстанцев получили выплату в 42 500 тенге
Айсана,2020-07-29 17:20:59,"Те кто жалуются что вообще не получили,вы специально на негатив нагнетаете людей",,Почти 2 миллиона казахстанцев получили выплату в 42 500 тенге
Гулимай Адилбек,2020-07-29 18:30:08,фейк ақпарат тартып нені көздейді екен,Айсана,Почти 2 миллиона казахстанцев получили выплату в 42 500 тенге
Айсана,2020-07-29 17:21:29,я рада что более 2 млн казахстанцам выделили деньги,,Почти 2 миллиона казахстанцев получили выплату в 42 500 тенге
Айсана,2020-07-29 17:21:54,"все таки бюджет не резиновый,но правительству придется идти на такой риск",Айсана,Почти 2 миллиона казахстанцев получили выплату в 42 500 тенге
Айсана,2020-07-29 17:22:26,"тем более риск экономического спада очень велик,но соц выплаты все равно не отменяют",Айсана,Почти 2 миллиона казахстанцев получили выплату в 42 500 тенге
Гулимай Адилбек,2020-07-29 18:27:02,"Халықты қолдау мақсатында үкімет барлық іс-шаралар орындалып жатыр, Бірақ адамдарда түсіну керек бюджеттегі ақшада барлығына бірдей жетпейді. Расыменде мұқтаж жандарға беріліп жатыр",Айсана,Почти 2 миллиона казахстанцев получили выплату в 42 500 тенге
Гулимай Адилбек,2020-07-29 18:28:11,"Әлемде болып жатқан дағдарысқа қарамастан, біздің мемлекет жәрдемақы беріп жатыр, зейнетақының көлемінде азда болсада қосып жатыр",Айсана,Почти 2 миллиона казахстанцев получили выплату в 42 500 тенге
Гулимай Адилбек,2020-07-29 18:25:17,жақсы жаңалық,Айсана,Почти 2 миллиона казахстанцев получили выплату в 42 500 тенге
Bagila Zhumabekova,2020-07-29 17:41:43,"Думаю, что выплаты были назначены именно тем людям, которые подходили по требованиям и действительно потеряли доход. А таких людей оказалось достаточно.",,Почти 2 миллиона казахстанцев получили выплату в 42 500 тенге
Birzhan,2020-07-29 17:43:51,Да,Bagila Zhumabekova,Почти 2 миллиона казахстанцев получили выплату в 42 500 тенге
Birzhan,2020-07-29 17:44:02,2 миллиона это очень много,Birzhan,Почти 2 миллиона казахстанцев получили выплату в 42 500 тенге
Bagila Zhumabekova,2020-07-29 18:14:44,"может и немного, но для государства в период кризиса это выходит приличная сумма",Birzhan,Почти 2 миллиона казахстанцев получили выплату в 42 500 тенге
Гулимай Адилбек,2020-07-29 18:17:19,Жалпы алғанда жаман емес,Birzhan,Почти 2 миллиона казахстанцев получили выплату в 42 500 тенге
Birzhan,2020-07-29 18:17:50,Это да,Bagila Zhumabekova,Почти 2 миллиона казахстанцев получили выплату в 42 500 тенге
Birzhan,2020-07-29 18:18:07,"Думаю стоит довольствоваться тем, что есть",Birzhan,Почти 2 миллиона казахстанцев получили выплату в 42 500 тенге
Гулимай Адилбек,2020-07-29 18:18:57,"Дағдарыс кезінде осындай жәрдемақы тағайындап, халыққа таратып беру көп мемлекеттің қолынан келе бермейді. Азда болсада қанағат қылу керек",Bagila Zhumabekova,Почти 2 миллиона казахстанцев получили выплату в 42 500 тенге
Bagila Zhumabekova,2020-07-29 18:19:41,"Конечно. Не слышала , чтобы в соседних странах СНГ делали людям выплаты, так что у нас все еще не так плохо. Но не стоит сравнивать наши выплаты с выплатами в США.",Birzhan,Почти 2 миллиона казахстанцев получили выплату в 42 500 тенге
Гулимай Адилбек,2020-07-29 18:24:07,Ойыңызбен толықтай келісемін. Әрине АҚШ қарағанда біздің жәрдемақы азда болсада қанағат танытарлық. Басқа мемлекеттерге қарағанда еліміздің экономикалық ахуалы әжептеуір жақсы,Bagila Zhumabekova,Почти 2 миллиона казахстанцев получили выплату в 42 500 тенге
Нуржан Бериков,2020-07-29 20:14:38,"да, я тоже не слышал, надо радоваться тому, что есть)",Bagila Zhumabekova,Почти 2 миллиона казахстанцев получили выплату в 42 500 тенге
Нуржан Бериков,2020-07-29 18:13:09,"очень хорошо, что выплатили))",Bagila Zhumabekova,Почти 2 миллиона казахстанцев получили выплату в 42 500 тенге
Гулимай Адилбек,2020-07-29 18:19:12,согласна,Нуржан Бериков,Почти 2 миллиона казахстанцев получили выплату в 42 500 тенге
Гулимай Адилбек,2020-07-29 18:16:48,шыныменде мұқтаж жандарға бұйырса екен,Bagila Zhumabekova,Почти 2 миллиона казахстанцев получили выплату в 42 500 тенге
Гулимай Адилбек,2020-07-29 18:14:01,"Екі миллионға жуық халыққа берілген жәрдемақы қазіргі кезде ауадай қажет. Ең бастысы мұқтаж отбасылар алып жатыр, кейбір зейнеткер көрші апайларды алғанына қуаныштымын.",,Почти 2 миллиона казахстанцев получили выплату в 42 500 тенге
Bagila Zhumabekova,2020-07-29 18:36:17,"Иа, шынымен қажет ететін адамдар алғаны жақсы болды",Гулимай Адилбек,Почти 2 миллиона казахстанцев получили выплату в 42 500 тенге
Bagila Zhumabekova,2020-07-29 18:36:59,Ал негізі адамдардың көбісі жұмысына әдеттегідей барып жүр,Bagila Zhumabekova,Почти 2 миллиона казахстанцев получили выплату в 42 500 тенге
Birzhan,2020-07-29 18:37:34,Иа,Bagila Zhumabekova,Почти 2 миллиона казахстанцев получили выплату в 42 500 тенге
Birzhan,2020-07-29 18:37:57,Сондықтан да бәрі ақшаны алып жатқан жоқ,Birzhan,Почти 2 миллиона казахстанцев получили выплату в 42 500 тенге
Нуржан Бериков,2020-07-29 18:14:35,"сейчас много тех, кто нуждается в этих выплатах и я рад, что столько людей смогли получить эти деньги )",,Почти 2 миллиона казахстанцев получили выплату в 42 500 тенге
Гулимай Адилбек,2020-07-29 18:15:51,Әрине барлығымыз үшін жақсы жаңалық,Нуржан Бериков,Почти 2 миллиона казахстанцев получили выплату в 42 500 тенге
Нуржан Бериков,2020-07-29 18:17:46,"вот этим наше государство ещё раз показало, что даже несмотря на всю эту сложную ситуацию и с экономикой тоже,  все равно готовы поддержать население страны",,Почти 2 миллиона казахстанцев получили выплату в 42 500 тенге
Нуржан Бериков,2020-07-29 18:18:42,"так что они делают всё возможное со своей стороны во благо народа,чтобы поддержать народ в это время",Нуржан Бериков,Почти 2 миллиона казахстанцев получили выплату в 42 500 тенге
Хозяин умпалумп,2020-07-29 18:20:12,Но есть люди которые берут 42500 и при это матерят власть. Странные люди...,Нуржан Бериков,Почти 2 миллиона казахстанцев получили выплату в 42 500 тенге
Mcke,2020-07-29 22:14:59,"Гулимай и нуржан, молодцы, два послушных бота",Нуржан Бериков,Почти 2 миллиона казахстанцев получили выплату в 42 500 тенге
Birzhan,2020-07-29 18:22:45,Очень радует эта новость.  Многие люди остались временно без заработка и рассчитывали на какую-либо поддержку от государства. И государство вошло в положение людей и поддержали их в этом месяце.,,Почти 2 миллиона казахстанцев получили выплату в 42 500 тенге
Bagila Zhumabekova,2020-07-29 18:24:12,Да,Birzhan,Почти 2 миллиона казахстанцев получили выплату в 42 500 тенге
Bagila Zhumabekova,2020-07-29 18:24:21,Спасибо за это,Bagila Zhumabekova,Почти 2 миллиона казахстанцев получили выплату в 42 500 тенге
Bagila Zhumabekova,2020-07-29 18:33:36,"Введение карантина для кого-то было совсем не приятной новостью. Но это было необходимым решением для стабилизации ситуации в стране и для того , чтобы снизить нагрузку на больницы.",Bagila Zhumabekova,Почти 2 миллиона казахстанцев получили выплату в 42 500 тенге
Birzhan,2020-07-29 18:34:15,Да,Bagila Zhumabekova,Почти 2 миллиона казахстанцев получили выплату в 42 500 тенге
Birzhan,2020-07-29 18:34:30,Как мы видим ситуация улучшилась,Birzhan,Почти 2 миллиона казахстанцев получили выплату в 42 500 тенге
Bagila Zhumabekova,2020-07-29 18:35:03,Это самое главное,Birzhan,Почти 2 миллиона казахстанцев получили выплату в 42 500 тенге
Bagila Zhumabekova,2020-07-29 18:35:26,А в качестве компенсации и поддержки были сделаны выплаты,Bagila Zhumabekova,Почти 2 миллиона казахстанцев получили выплату в 42 500 тенге
Нуржан Бериков,2020-07-29 20:13:00,"да, выплаты главное есть , хоть какая-то помощь)",Birzhan,Почти 2 миллиона казахстанцев получили выплату в 42 500 тенге
Светлана Доценко,2020-07-29 19:46:48,"Как будто миллионы дают,это не покроет потерянных доходов да и семью не прокормить. Такое ощущение ,что детей в нашей стране нет .😓",,Почти 2 миллиона казахстанцев получили выплату в 42 500 тенге
Сағыныш Жумагельдина,2020-07-29 20:24:40,Енді диз.раствормен хайп жасауға көшкен бе ?,,Почти 2 миллиона казахстанцев получили выплату в 42 500 тенге
Алик Аликов,2020-07-29 22:12:14,я потерял доход мне отказали будем разбираться в суде,,Почти 2 миллиона казахстанцев получили выплату в 42 500 тенге
Mcke,2020-07-29 22:13:20,"""вы не плательщик есп"", говорили они, пошел заплатил есп - ""вам отказано, потому что у вас нет платежей с января по июнь"". Вот сразу нельзя было это написать? Или так хитро нужно было утащить у меня 2600?",,Почти 2 миллиона казахстанцев получили выплату в 42 500 тенге
Александр Плотников,2020-07-29 11:02:31,установку системы РЭП испытываю короче,,Слухи о влиянии магнитных бурь на здоровье опроверг ученый 
Генерал Епанчин,2020-07-29 11:31:48,Не знаю как на кого но на меня сольно действуют,,Слухи о влиянии магнитных бурь на здоровье опроверг ученый 
