name_author,date_publication,text_comment,answer_to,name_articleAndrey Lomakin,2020-07-29 15:03:21,"а самый сок будет, если признают виновным автомобиль, типа неисправный был...",Andrey Lomakin,Ефремов отказался от признания вины
Otto,2020-07-29 15:05:24,"тут то и интересно, машина прошла экспертизу, машина исправна, взяли анализ с подушки безопасности, там днк Ефремова, уже не знаю, чем они его невиновность доказывать собираются",Andrey Lomakin,Ефремов отказался от признания вины
Хозяин умпалумп,2020-07-29 15:06:11,"Уже не спрыгнет. от него даже московская тусовка отвернулась, правда не вся. Есть упоротые собутыльники. А еще есть истеричные тетки в интернете которые уверенны что ефремова напоила ФСБ и бухого привязала к рулю.Как человек для россиян ефремов закончен.",Andrey Lomakin,Ефремов отказался от признания вины
Николай Репников,2020-07-29 15:06:14,"Неадекватным поведением последней,типа - мозги съехали....",Otto,Ефремов отказался от признания вины
Andrey Lomakin,2020-07-29 15:07:43,"так даже если дадут срок, то минимальный, а потом вдруг амнистия и все.. дальше пойдет бухать за рулем ..",Хозяин умпалумп,Ефремов отказался от признания вины
Хозяин умпалумп,2020-07-29 15:15:08,"Вот только уже не получится яростно кукарекать про ""российскую власть"". ибо выходит власть его и отмазала?",Andrey Lomakin,Ефремов отказался от признания вины
отряды  путина,2020-07-29 17:13:56,Тебе по роду твоей деятельности повсюду фсб мерещится,Хозяин умпалумп,Ефремов отказался от признания вины
Ермек,2020-07-29 17:55:40,Автомобиль был заправлен алкосодержащим бензино,Andrey Lomakin,Ефремов отказался от признания вины
Хозяин умпалумп,2020-07-29 15:05:02,"Шакал! Мразота! А как дышал то, как страдал. Спрашивал как жить дальше. Видимо трезвый был три дня. Я поражаюсь, как можно столько трындеть про нечестный режим в стране покрывающий преступность и взятки, а потом спрыгнуть после убийства с признания вины. Реально падаль.",,Ефремов отказался от признания вины
Александр,2020-07-29 15:06:49,"Так тут логично, если даже мачеха себя потерпевшей считает и хотят 40 лямов рублей за моральный ущерб. Не треснит ли морда!!!",Хозяин умпалумп,Ефремов отказался от признания вины
Хозяин умпалумп,2020-07-29 15:08:12,"А во сколько бы ты оценил смерть своего отца, если бы его переехал Ефремов?",Александр,Ефремов отказался от признания вины
Николай Репников,2020-07-29 15:08:13,"""За всё в жизни надо платить""...по полной!",Александр,Ефремов отказался от признания вины
Хозяин умпалумп,2020-07-29 15:09:15,"И причем тут выплаты, если ефремов вообще не считает себя виновным. В не зависимости от выплат Ефремов как честный человек должен был пойти на зону. Он столько ""страдал"" на камеру в ютубе. А оказалось что все его страдания не стоят пустого пузыря",Александр,Ефремов отказался от признания вины
Исаак ,2020-07-29 17:08:30,"Наверное его папаша, гроше ломаного не стоит, раз воспитал такого сыночка.",Хозяин умпалумп,Ефремов отказался от признания вины
Елена Туча,2020-07-29 17:49:03,"Нсли как Усенов, тоже совесть нации, то курс 0 тенге 0тиинов",Хозяин умпалумп,Ефремов отказался от признания вины
Хозяин умпалумп,2020-07-29 18:46:23,"Батя у него был отличный человек, актерище и простой по жизни. А вот сынок сговнился по полной",Исаак ,Ефремов отказался от признания вины
Исаак ,2020-07-29 21:41:10,"Понятно, я про папашу комментатора под НИКом Александр, к нему относится.",Хозяин умпалумп,Ефремов отказался от признания вины
Николай Репников,2020-07-29 15:05:06,"Прискорбно, что ""простого смертного"" уже давно раза три в асфальт закатали бы, а здесь- пьяная знаменитость, на которого после случившегося и смотреть-то противно!!!!",,Ефремов отказался от признания вины
nightpatrol,2020-07-29 15:30:16,"Да и хер с ним, пусть скота так сажают, а раз не признался, ещё и накинуть пару лет сверху.",,Ефремов отказался от признания вины
m_icas Муртазина,2020-07-29 15:30:39,Убийца- с этим клеймом жить дальше и желательно получить все что причитается,,Ефремов отказался от признания вины
Хозяин умпалумп,2020-07-29 15:35:13,Старый петух перечеркнул всё своё кукареканье про совесть и честь.,,Ефремов отказался от признания вины
Филимон,2020-07-29 16:05:07,Киркоров и Меладзе спрыгнули же и Ефремов не исключение. ,,Ефремов отказался от признания вины
Патрон,2020-07-29 16:45:14,Почитал комменты и очень ужаснулся,,Ефремов отказался от признания вины
Хозяин умпалумп,2020-07-29 17:57:58,Скотству Ефремова?,Патрон,Ефремов отказался от признания вины
Патрон,2020-07-29 18:02:41,"Тому, что комментаторы тут понаписал. Суд определит Ефремову меру наказания, но посторонние, не имеющие к событию люди....",Хозяин умпалумп,Ефремов отказался от признания вины
Хозяин умпалумп,2020-07-29 18:47:36,"Суд то определит, но есть еще общечеловеческие нормы. и поскольку ефремов живет не в своей личной Вселенной, другие могут давать ему оценку, я не прав? Тем более после го слезливых видосиков где он говорит что он виноват и не знает как жить. Знает оказывается...",Патрон,Ефремов отказался от признания вины
Елена Туча,2020-07-29 17:47:45,"Что сразу накинулись!  По ЭХО МОСКВЫ сегодня про него :"" ворческая личность, душа таланта, добродетель искусства и совесть нации"", а вы сразу алкаш",,Ефремов отказался от признания вины
Хозяин умпалумп,2020-07-29 17:58:44,"Есть версия что ФСБ подлили воду в алкоголь Ефремова, в результате чего он стал не управляем. организм не справился с таким шоком.",,Ефремов отказался от признания вины
Берик Серик,2020-07-29 18:21:16,Чмошник,,Ефремов отказался от признания вины
Хозяин умпалумп,2020-07-29 18:23:28,"Ну что вы. он же артист, творческая личность, ранимая душа, символ борьбы с кровавым режимом, поэт и дигустатор",Берик Серик,Ефремов отказался от признания вины
๑۩۞۩✶𝔇𝔞𝔯𝔨𝔚𝔞𝔳𝔢✶۩۞۩๑,2020-07-29 18:42:29,"Хитрое позорище, сидеть не хочет, денег не хочет давать тоже, юлит всё то одно то другое, то повесился а теперь попятную выставил алкаш 🤦‍♂️",,Ефремов отказался от признания вины
Питер Восточн,2020-07-29 14:59:39,На опережение?!,,Аким Шымкента уволил двух замов
Людмила Соболева,2020-07-29 19:04:32,Мамытбеков сам написал заявление по собственному,Питер Восточн,Аким Шымкента уволил двух замов
Лена,2020-07-29 15:43:34,замы причем?,,Аким Шымкента уволил двух замов
USSR,2020-07-29 16:08:38,Похоже всю работу замы и делают. Поэтому и попадают.,,Аким Шымкента уволил двух замов
Александр Юрьевич,2020-07-29 17:01:20,Причина?,,Аким Шымкента уволил двух замов
Посетитель,2020-07-29 17:04:41,Неэффектно потоки регулировали...,Александр Юрьевич,Аким Шымкента уволил двух замов
Людмила Соболева,2020-07-29 19:05:33,"Работать в Акимате,надо иметь фамилию",Александр Юрьевич,Аким Шымкента уволил двух замов
Куерти Клавиатуров,2020-07-29 17:47:57,"Чо то назначают кого то убирают, сами по себе чо то творят!",,Аким Шымкента уволил двух замов
Ахмад-Шах Массуд,2020-07-29 21:49:14,Бабки отбили и ушли...,Куерти Клавиатуров,Аким Шымкента уволил двух замов
Хатира Танымова,2020-07-29 18:48:57,Иманды болсын.,,Аким Шымкента уволил двух замов
Ахмад-Шах Массуд,2020-07-29 21:49:47,:;),Хатира Танымова,Аким Шымкента уволил двух замов
Айсултан,2020-07-29 19:23:04,Формулировки при увольнение какие? Если по собственному то в принципе ничего не значит увольнение.,,Аким Шымкента уволил двух замов
Rus Rus,2020-07-29 20:21:41,"Кто они? Ну и что, уволили, подумаешь? Что изменится?",,Аким Шымкента уволил двух замов
Cashier,2020-07-29 15:53:12,"Вы только после полугода пандемии это поняли, что строить надо?",,Эксперты: Казахстану необходимы инфекционные госпитали
Алик Аликов,2020-07-29 22:37:08,реквизировать все здания под тойхана вот вам и госпиталя,,Эксперты: Казахстану необходимы инфекционные госпитали
Олег,2020-07-29 14:45:29,"ну раз ""эксперты"" говорят, тогда да ""правильное решение""",,Своими мнениями о продлении карантина поделились эксперты 
Посетитель,2020-07-29 17:13:50,"Политологи что? Им лишь бы языком як помелом... А сколько прдавцов на рынках попадает.Особенно те кто одеждой торгует... Саиров что ... бывший директор Института ""культурной"" политики... Им лишь бы власти польстить,чтобы их заметили и место хлебное дали, типа издания о Чокане Валиханове...",Олег,Своими мнениями о продлении карантина поделились эксперты 
Andrey Lomakin,2020-07-29 14:50:49,"Может я тоже буду ""экспертом"", просто буду говорить что ""все хорошо"", ""правильно все делаете"" ...",,Своими мнениями о продлении карантина поделились эксперты 
Аргын,2020-07-29 14:53:17,,,Своими мнениями о продлении карантина поделились эксперты 
Очень Злой Хомяк,2020-07-29 15:07:46,"Безусловно очень верное решение и очень нужные меры! Страны которые соблюдают карантинные меры, бьют палками, тратят кучу денег, штрафуют непорядочных,
переживают пик эпидемии всего за 45 дней. А вот страны, которые ничерта не делают у них пик длится целых 1.5 месяца!",,Своими мнениями о продлении карантина поделились эксперты 
Тигрохауд,2020-07-29 15:18:57,"Не знаю как у вас месяц длится, у нас в среднем 30 дней. Получается 30+15=45 дней=1,5 месяцам",Очень Злой Хомяк,Своими мнениями о продлении карантина поделились эксперты 
Очень Злой Хомяк,2020-07-29 15:30:03,Понимаю) Тяжелый случай),Тигрохауд,Своими мнениями о продлении карантина поделились эксперты 
Надежда Быкова,2020-07-29 16:40:50,"Позвольте с Вами не согласиться. Дело не только в карантине, но и в готовности медицины и госаппарата  правильно и своевременно встречать вирус. А У нас что, карантин объявили, 2 месяца всех продержали, потом резко всех отпустили, вспомните в промежуток 7-10 дней, а то и меньше принимались  решения по ослаблению. А теперь народ ругают, что якобы нарушают карантин.",Очень Злой Хомяк,Своими мнениями о продлении карантина поделились эксперты 
Rokurokubi,2020-07-29 15:18:28,"а что, блогеры у нас теперь тоже ""эксперты""?",,Своими мнениями о продлении карантина поделились эксперты 
Посетитель,2020-07-29 17:16:53,Так они еще с этого бабки имеют... СМИ пора делать так чтобы эти блогеры и политологи им предлагали деньги за то что напечатают или покажут их...,Rokurokubi,Своими мнениями о продлении карантина поделились эксперты 
*,2020-07-29 15:55:40,"бурные продолжительные аплодисменты, переходящие в овации",,Своими мнениями о продлении карантина поделились эксперты 
Otto,2020-07-29 14:17:49,"с таким видом, ей надо вести новости для блатный, типа: а теперь покалякаем о делах наших скорбных  ",,У телеведущей выпал зуб в прямом эфире
иван петров,2020-07-29 15:03:47,"Этой ""новости"" уже две недели.",,У телеведущей выпал зуб в прямом эфире
Александр Плотников,2020-07-29 15:34:06,"уже не знают чего писать, с утра вообще комменты отключили",иван петров,У телеведущей выпал зуб в прямом эфире
Куерти Клавиатуров,2020-07-29 16:56:05,К счасью,,У телеведущей выпал зуб в прямом эфире
Babaika Iz Xisgini,2020-07-29 22:15:44,Отличный бизнес,,Похожую на очки защитную маску изобрели в Новой Зеландии
Жома,2020-07-29 16:21:00,"Интересно, а у ТОП-менеджмента ЕНПФ за это время во сколько выросли доходы? )))",,"Пенсионные накопления казахстанцев выросли на 9,1% за полгода"
Mike Mike,2020-07-29 21:43:37,"И не сосчитать,устанет рука!!!",Жома,"Пенсионные накопления казахстанцев выросли на 9,1% за полгода"
Марина Лигай,2020-07-29 19:27:39,"А да, сумма инвест дохода увеличилась в пенсионке. Но это как качели, то вверх, то вниз",,"Пенсионные накопления казахстанцев выросли на 9,1% за полгода"
Mike Mike,2020-07-29 21:43:03,Почему не даёте на лечение детей инвалидов??? Хоть 50%!!!,,"Пенсионные накопления казахстанцев выросли на 9,1% за полгода"
Иса,2020-07-29 14:02:39,давно пора,,Плату за парковку предложили поднять возле Зеленого базара Алматы
g02 a06,2020-07-29 14:05:21,Ну ты и подпевала,Иса,Плату за парковку предложили поднять возле Зеленого базара Алматы
Takke,2020-07-29 14:53:43,"Что за общественный совет? Можно их данные? Вообще по городу нужно отменить все платные парковки. Эти парковки строились на деньги народа, земля принадлежит народу, а какие то проходимцы ничего не делая рубят капусту. Хватит наверно драть с народа последнее. Поднимите цены на налог обладателям коттежей свыше 150 кв.м., поднимите цены на парковки в крутых бизнес центрах, на крутые машины в сотни раз. Может этому совету нужно подумать как цены спустить и как их вообще убрать? Или в долю пригласили?",Иса,Плату за парковку предложили поднять возле Зеленого базара Алматы
Vitaliy,2020-07-29 18:14:46,"Общественный совет, по лично моему мнению и наблюдению, это прикрытие для принятия решений не популярных антинародных решений.",Takke,Плату за парковку предложили поднять возле Зеленого базара Алматы
денис пасухин,2020-07-29 22:02:10,Хозяева машин и коттеджей по 1500кв.м и создали этот совет чтоб машины поменять на самолёты а коттеджи на микрорайоны,Takke,Плату за парковку предложили поднять возле Зеленого базара Алматы
Tiger15,2020-07-29 14:10:06,Люди на базар приезжают за покупками!Они что хотят чтобы с полными сумками в автобусы залезали ?Вообще отменить эти платные парковки нужно.Не нужны они жителями.Делают деньги из воздуха.,,Плату за парковку предложили поднять возле Зеленого базара Алматы
artemjev_vlad@list.ru,2020-07-29 15:02:22,"Нет, они предлагают тяжолые сумки за 2-3 квартала до машины тащить. Хотя с автобусом тоже согласен.",Tiger15,Плату за парковку предложили поднять возле Зеленого базара Алматы
Vincento Vegas,2020-07-29 14:15:41,"Придет время,отменим эти парковки.Скоро!",,Плату за парковку предложили поднять возле Зеленого базара Алматы
g02 a06,2020-07-29 14:47:35,"Сагинтаев? А, нет, Боранбаев?",Vincento Vegas,Плату за парковку предложили поднять возле Зеленого базара Алматы
dauren,2020-07-29 14:16:17,Все мало этим хозяевам жизни,,Плату за парковку предложили поднять возле Зеленого базара Алматы
dauren,2020-07-29 14:17:03,В бюджет города попадает мизер,,Плату за парковку предложили поднять возле Зеленого базара Алматы
valeriy,2020-07-29 14:18:12,"А они (""А-Паркинг"") в эти парковки что-то вкладывают что-ли? С чего это вдруг тариф в 2 раза поднимать?. После этого потихаря и по всему городу поднимут, и вот тебе уже + 100% !!!",,Плату за парковку предложили поднять возле Зеленого базара Алматы
A B,2020-07-29 22:13:50,"Ничего! Зимой даже снег не чистят, только штрафы исправно выписывают",valeriy,Плату за парковку предложили поднять возле Зеленого базара Алматы
Все Будет Хорошо,2020-07-29 14:21:12,Вообще-то зарабатные платы с 2016года не только остались на своих местах и упали. Предлагаю снести эти парктоматы к чертовой матери. Это наши улицы. А если хотят пусть сооружают и поднимают цены где нибудь в Барсакельмесе.,,Плату за парковку предложили поднять возле Зеленого базара Алматы
Галымжан Мусаев,2020-07-29 14:41:00,Вот за парковку взялись может ещё за транспорт возметесть что в городе много стало,,Плату за парковку предложили поднять возле Зеленого базара Алматы
Takke,2020-07-29 14:55:28,"ходи пешком и родне посоветуй, кто мешает? Многие за счет машин и кормятся, не надеясь на государство.",Галымжан Мусаев,Плату за парковку предложили поднять возле Зеленого базара Алматы
Аргын,2020-07-29 14:55:00,"После того, как ввели платные парковки повсюду, реально негде поставить машину. Что за нонсенс. Раньше и то таких проблем не было. Может, действительно, надо поднять стоимость?",,Плату за парковку предложили поднять возле Зеленого базара Алматы
