name_author,date_publication,text_comment,answer_to,name_articleKamila Zhaksybayeva,2020-07-29 17:19:38,"это точно , главное что бы успели сделать все , ведь даже воз говорить что скоро будет вторая волна",Айнур,Досмухамбетов доложил Токаеву о стабилизации обстановки в области
Айнур,2020-07-29 17:08:07,действительно Атырау не единственный такой город,Думан Абильдин,Досмухамбетов доложил Токаеву о стабилизации обстановки в области
Айнур,2020-07-29 17:08:41,"Прочитала статью, что в Шымкенте тоже ситуация нормализовалась у них прирост почти 1%",Думан Абильдин,Досмухамбетов доложил Токаеву о стабилизации обстановки в области
Айнур,2020-07-29 17:09:16,"В любом случаю, думаю что даже если показатели стали лучше нужно все еще повременить с полным послаблением",Думан Абильдин,Досмухамбетов доложил Токаеву о стабилизации обстановки в области
Айнур,2020-07-29 17:09:44,Надо очень ответственно и постепенно идти к этому,Думан Абильдин,Досмухамбетов доложил Токаеву о стабилизации обстановки в области
Нуржан Бериков,2020-07-29 18:45:45,согласен!,Думан Абильдин,Досмухамбетов доложил Токаеву о стабилизации обстановки в области
Айнур,2020-07-29 17:06:07,"Очень рада, что в Атырау обстановка улучшилась",,Досмухамбетов доложил Токаеву о стабилизации обстановки в области
Айнур,2020-07-29 17:06:40,Они за какие то пару дней обогнали ведь по зараженным и Нур Султан и Алматы,Айнур,Досмухамбетов доложил Токаеву о стабилизации обстановки в области
Айнур,2020-07-29 17:06:57,"Многие знакомые говорили, что там врачей не хватает",Айнур,Досмухамбетов доложил Токаеву о стабилизации обстановки в области
Arman Serik,2020-07-29 17:13:05,"да , тоже слышал об этом , надеюсь сейчас ситуация поменялась там",Айнур,Досмухамбетов доложил Токаеву о стабилизации обстановки в области
Айнур,2020-07-29 17:07:14,Наверное этот вопрос сразу уже решили,Айнур,Досмухамбетов доложил Токаеву о стабилизации обстановки в области
Arman Serik,2020-07-29 17:12:36,"конечно будет сразу решать такие вопросы , вряд ли оставят на потом",Айнур,Досмухамбетов доложил Токаеву о стабилизации обстановки в области
Айнур,2020-07-29 17:07:32,Главное что сейчас все нормально,Айнур,Досмухамбетов доложил Токаеву о стабилизации обстановки в области
Arman Serik,2020-07-29 17:12:09,"надеюсь , скоро все наладится к лучшему , главное сейчас по возможности беречь свое здоровье",Айнур,Досмухамбетов доложил Токаеву о стабилизации обстановки в области
Sunkar Ibatov,2020-07-29 17:25:03,"конечно, хорошо что люди поняли это",Arman Serik,Досмухамбетов доложил Токаеву о стабилизации обстановки в области
Sunkar Ibatov,2020-07-29 17:25:22,ведь в начале были даже такие кто не верил в корону,Sunkar Ibatov,Досмухамбетов доложил Токаеву о стабилизации обстановки в области
Sunkar Ibatov,2020-07-29 17:25:55,сейчас сам замечаю что количество зараженных уменьшается,Sunkar Ibatov,Досмухамбетов доложил Токаеву о стабилизации обстановки в области
Нуржан Бериков,2020-07-29 18:47:30,"кажется , ситуация потихоньку начинает налаживаться",,Досмухамбетов доложил Токаеву о стабилизации обстановки в области
Нуржан Бериков,2020-07-29 18:48:08,"сейчас бы ,чтобы во всех регионах стабилизировалась",Нуржан Бериков,Досмухамбетов доложил Токаеву о стабилизации обстановки в области
Ахмет Измайлов,2020-07-29 21:58:17,"главное сейчас держать этот темп,чтобы не стало хуже",Нуржан Бериков,Досмухамбетов доложил Токаеву о стабилизации обстановки в области
Ахмет Измайлов,2020-07-29 21:57:39,"даа,все таки от карантина толк был) кто бы что бы не говорил",Нуржан Бериков,Досмухамбетов доложил Токаеву о стабилизации обстановки в области
Bagila Zhumabekova,2020-07-29 19:59:16,"Вроде говорили, что в городе Атырау один из самых высоких показателей по заболеваемости коронавирусом. Думаю, поэтому в этом городе особый контроль...",,Досмухамбетов доложил Токаеву о стабилизации обстановки в области
Birzhan,2020-07-29 20:00:01,Сейчас везде высокая заьолеваемость,Bagila Zhumabekova,Досмухамбетов доложил Токаеву о стабилизации обстановки в области
Birzhan,2020-07-29 20:00:17,Везде контроль нужен,Birzhan,Досмухамбетов доложил Токаеву о стабилизации обстановки в области
Bagila Zhumabekova,2020-07-29 20:03:17,"он осуществляется , без этого никак",Birzhan,Досмухамбетов доложил Токаеву о стабилизации обстановки в области
Bagila Zhumabekova,2020-07-29 20:04:14,"также многое и от людей самих зависит,",Bagila Zhumabekova,Досмухамбетов доложил Токаеву о стабилизации обстановки в области
Birzhan,2020-07-29 20:04:24,Согласен,Bagila Zhumabekova,Досмухамбетов доложил Токаеву о стабилизации обстановки в области
Birzhan,2020-07-29 20:04:38,А так всевозможные меры принимаются,Birzhan,Досмухамбетов доложил Токаеву о стабилизации обстановки в области
Bagila Zhumabekova,2020-07-29 20:04:53,и это дает результат,Birzhan,Досмухамбетов доложил Токаеву о стабилизации обстановки в области
Birzhan,2020-07-29 20:05:03,"Да, конечно",Bagila Zhumabekova,Досмухамбетов доложил Токаеву о стабилизации обстановки в области
Нуржан Бериков,2020-07-29 20:26:43,"конечно! будут каждым человеком соблюдаться меры , будет и стабилизация ситуации",Bagila Zhumabekova,Досмухамбетов доложил Токаеву о стабилизации обстановки в области
Bagila Zhumabekova,2020-07-29 20:14:55,"К сожалению, ситуация с коронавирусом не такая простая и приходится принимать комплекс мер для стабилизации ситуации. И нам нужно с пониманием к этому отнестись",,Досмухамбетов доложил Токаеву о стабилизации обстановки в области
Birzhan,2020-07-29 20:16:49,"Не беспокойтесь. Все всё хорошо понимают. Просто некоторым людям все равно на здоровье других , ну а кому-то это все действительно доставляет неудобства. Ничего уж не сделаешь.",Bagila Zhumabekova,Досмухамбетов доложил Токаеву о стабилизации обстановки в области
Bagila Zhumabekova,2020-07-29 20:16:56,да,Birzhan,Досмухамбетов доложил Токаеву о стабилизации обстановки в области
Bagila Zhumabekova,2020-07-29 20:17:08,Нету ничего важнее здоровья,Bagila Zhumabekova,Досмухамбетов доложил Токаеву о стабилизации обстановки в области
Birzhan,2020-07-29 20:17:35,Конечно.,Bagila Zhumabekova,Досмухамбетов доложил Токаеву о стабилизации обстановки в области
Bagila Zhumabekova,2020-07-29 20:19:23,"На самом деле такие масштабные меры даже могут быть не так эффективны, так как на это есть причина. Люди ходят без масок, заражают друг друга, и вообще наплевали на здоровье окружающих.",Birzhan,Досмухамбетов доложил Токаеву о стабилизации обстановки в области
Birzhan,2020-07-29 20:19:56,"Ну если бы их не было, не нужны были бы все эти меры",Bagila Zhumabekova,Досмухамбетов доложил Токаеву о стабилизации обстановки в области
Bagila Zhumabekova,2020-07-29 20:20:16,"нет, все таки нужны штрафы",Birzhan,Досмухамбетов доложил Токаеву о стабилизации обстановки в области
Ахмет Измайлов,2020-07-29 21:55:54,да наших уже и штрафом не запугаешь),Bagila Zhumabekova,Досмухамбетов доложил Токаеву о стабилизации обстановки в области
Ахмет Измайлов,2020-07-29 21:56:28,"нужно что то менять,прям со школы хотя бы базовые знания внести ччто-ли",Bagila Zhumabekova,Досмухамбетов доложил Токаеву о стабилизации обстановки в области
Нуржан Бериков,2020-07-29 20:29:38,"да , нужно потерпеть , как-то печально , но видимо нам нужно уже привыкнуть жить с вирусом и защищать свое здоровье от него",Bagila Zhumabekova,Досмухамбетов доложил Токаеву о стабилизации обстановки в области
Ахмет Измайлов,2020-07-29 21:55:39,"если каждый будет соблюдать санитарные нормы,угроза вируса будет намного ниже",Нуржан Бериков,Досмухамбетов доложил Токаеву о стабилизации обстановки в области
Ахмет Измайлов,2020-07-29 21:54:09,Блин да кто там до сих пор нарушает карантинные меры?,,Досмухамбетов доложил Токаеву о стабилизации обстановки в области
Ахмет Измайлов,2020-07-29 21:54:23,Сколько можно уже честное слово...,,Досмухамбетов доложил Токаеву о стабилизации обстановки в области
Ахмет Измайлов,2020-07-29 21:54:58,"вроде думаешь вот все,все всЁ поняли, а ннет, оказЦа не все",,Досмухамбетов доложил Токаеву о стабилизации обстановки в области
Патриот КЗ,2020-07-29 11:37:21,Трудно поставить себя и представить такое нашим ватникам такое с Путиным. Но Хабаровск молодец!,,Музыканты против Трампа: артисты подписали открытое письмо
Генерал Епанчин,2020-07-29 11:40:25,Ваши ватники на Украине представьте там это очень скоро против Зе,Патриот КЗ,Музыканты против Трампа: артисты подписали открытое письмо
Патриот КЗ,2020-07-29 11:47:31,"опять параноя, я казах, но за украинцев. против русской агрессии, вы же забрали территорию и создаете сепаратизм.",Генерал Епанчин,Музыканты против Трампа: артисты подписали открытое письмо
Генерал Епанчин,2020-07-29 11:52:04,"У вас паранойя и бред, я ничего не у кого не забирал я казахстанец, а почему вы не боритесь против другой агрессии и забирания  террироторий, почему вас патриота не видать на местных новостях, что то плохой из вас патриот как из меня балерина",Патриот КЗ,Музыканты против Трампа: артисты подписали открытое письмо
сланцевый майданщик,2020-07-29 12:01:42,"это потому, что он патриот сказочный - из сказочной страны, где вечно цвете и пахнет демократия, на улицах раздают печеньки, и безвиз в каждой кастрюле... только перед покупкой кухонной утвари надо непременно попрыгать на памятнике товарищу Ленину - или найти его бюст, и поцеловать его в губы!фууу..!то есть - пффффф",Патриот КЗ,Музыканты против Трампа: артисты подписали открытое письмо
Хозяин умпалумп,2020-07-29 12:14:32,Россия у Укроены ничего не забирала. А если ты такой принципиальный - не забыл как турки аннексировали Кипр?,Патриот КЗ,Музыканты против Трампа: артисты подписали открытое письмо
сланцевый майданщик,2020-07-29 12:29:50,"кастрюль он принципиальный, который прыгать не умеет!забрали территорию - а, вы эту территорию купили?у кого? и за сколько?вот покажете купчую - можете смело отобранные территории хоть на тот майдан забрать",Патриот КЗ,Музыканты против Трампа: артисты подписали открытое письмо
отряды  путина,2020-07-29 17:18:12,Так греки за Кипр пусть и потеют.,Хозяин умпалумп,Музыканты против Трампа: артисты подписали открытое письмо
Хозяин умпалумп,2020-07-29 17:20:44,"ну вы же тут за Крым потеете. А вообще ты молодец что признал Турцию агрессором и оккупантом. Эволюционируешь по малому. Сделаем из тебя если не человека, то хотя бы подобиеА там глядишь ты и с дерева слезешь, штаны научишься носить))",отряды  путина,Музыканты против Трампа: артисты подписали открытое письмо
сланцевый майданщик,2020-07-29 22:17:52,"шарлатан в портках?вот это номер!в цирк работать пойдете?кем?шарлатаном в портках?я такого номера даже в цирке не видел!скупаю все билеты на первый ряд!вива, Кальман!!!",отряды  путина,Музыканты против Трампа: артисты подписали открытое письмо
54321,2020-07-29 11:56:16,"Почти вся ""культурная элита"" в РФ не скрывает своего антипутинизма. ",Патриот КЗ,Музыканты против Трампа: артисты подписали открытое письмо
Хозяин умпалумп,2020-07-29 12:13:22,"""Культурная элита"" это ефремов и Собчак?",54321,Музыканты против Трампа: артисты подписали открытое письмо
54321,2020-07-29 12:29:50,"К сожалению их там много и у них очень высокая корпоративность, если ты не разделяешь их взгляды, тебе могут просто не дать работать, как минимум заклюют в информационном пространстве, а это опять же скажется на работе/заработке. ",Хозяин умпалумп,Музыканты против Трампа: артисты подписали открытое письмо
сланцевый майданщик,2020-07-29 12:05:22,"была бы его политическая воля, у культурной и цивилизованной элиты, вскормленная демократией как молоком матери, она бы в сию же минуту высыпала на Крещатик - и устроила бы самый разнузданный и безудержный майдан во все времена и народы!посчитали, во сколько печенек это обойдется - и решили, что Америка не потянет нового майдана...новый майдан денег стоит - даже у Америки нет столько денег!",Патриот КЗ,Музыканты против Трампа: артисты подписали открытое письмо
Плеканец Плеканец,2020-07-29 12:14:57,"Грантожуй, хватит подмахивать хозяевам. Молодцы - это Сиэттл,Балтимор,Атланта",Патриот КЗ,Музыканты против Трампа: артисты подписали открытое письмо
Хозяин умпалумп,2020-07-29 12:12:44,"Судя по этому ""открытому письму"" гражданская война в США набирает обороты и белый Дом там проигрывает по полной. музыканты выбрали сторону победителей, а Трамп с Белым Домом проигравшие",,Музыканты против Трампа: артисты подписали открытое письмо
Aleksei Morenets,2020-07-29 12:28:43,"""Технически американские законЫ об авторских правах""...Т.е. это не один Закон, а несколько? ",,Музыканты против Трампа: артисты подписали открытое письмо
Andrey Lomakin,2020-07-29 11:45:19,"Сейчас мошенников развилось в соц.сетях, особенно в ""телеграмме"", как только у людей совести хватает людей обманывать в эпоху эпидемии",,В Facebook появился фальшивый аккаунт Токаева
Адильхан Садыков,2020-07-29 13:51:09,Да их везде много. Пока люди верят они не переведутся.,Andrey Lomakin,В Facebook появился фальшивый аккаунт Токаева
Айнур,2020-07-29 17:15:26,"Ну не знаю, вроде как век развитых технологий а наши люди все еще верят",Адильхан Садыков,В Facebook появился фальшивый аккаунт Токаева
Айнур,2020-07-29 17:15:40,Наш народ очень наивен на самом деле),Адильхан Садыков,В Facebook появился фальшивый аккаунт Токаева
Айнур,2020-07-29 17:16:16,"В основном это взрослые люди, поэтому надо молодежи учить цифровой грамотности своих старших",Адильхан Садыков,В Facebook появился фальшивый аккаунт Токаева
Айнур,2020-07-29 17:16:56,Вот даже случай с 42500 показал какие наши люди наивные. многие попались на мошенников,Адильхан Садыков,В Facebook появился фальшивый аккаунт Токаева
Айнур,2020-07-29 17:17:23,Конечно каждый сам за себя ответсвенность несет в сети,Адильхан Садыков,В Facebook появился фальшивый аккаунт Токаева
Нуржан Бериков,2020-07-29 18:34:49,"после этого надеюсь, что все поймут ,что нельзя доверяться так!",Адильхан Садыков,В Facebook появился фальшивый аккаунт Токаева
Бауыржан Кошкинбай,2020-07-29 19:01:09,Адал еңбегінмен нан тапсаншы дегім келеді.,Адильхан Садыков,В Facebook появился фальшивый аккаунт Токаева
Бауыржан Кошкинбай,2020-07-29 19:01:37,"Оларда ақымақ емес, қалай алданып қалғанынды да түсінбей қаласын",Айнур,В Facebook появился фальшивый аккаунт Токаева
Бауыржан Кошкинбай,2020-07-29 19:02:04,"Ол да бар, алайда алайақтардың өздеріде ақымақ еместігін ескерген абзал",Айнур,В Facebook появился фальшивый аккаунт Токаева
Бауыржан Кошкинбай,2020-07-29 19:02:26,"Иә, қазіргі күннің үйреншікті көрінісі",Айнур,В Facebook появился фальшивый аккаунт Токаева
Бауыржан Кошкинбай,2020-07-29 19:03:02,Арамдықпен тапқан нандары қалай өтеді екен өнештен,Айнур,В Facebook появился фальшивый аккаунт Токаева
Бауыржан Кошкинбай,2020-07-29 19:03:31,"Әрине, алайда көріп тұрсан мән жәйді айтып бөліскен орынды",Айнур,В Facebook появился фальшивый аккаунт Токаева
Бауыржан Кошкинбай,2020-07-29 19:03:46,Очень даже на это надеюсь,Нуржан Бериков,В Facebook появился фальшивый аккаунт Токаева
Думан Абильдин,2020-07-29 15:15:53,"да, особенно в телеграмме, мошенники создавали на подобие ботов 42500 и люди сливали туда свои данные",Andrey Lomakin,В Facebook появился фальшивый аккаунт Токаева
Ертисбай Кажымуканов,2020-07-29 15:16:55,"намыс жок у таких людей, пытаются наживится в такое итак тяжелое время",Думан Абильдин,В Facebook появился фальшивый аккаунт Токаева
